Subcorpus	Filename	Year data collection	Sex	Age	School/University/Institution	Major	Year at university/school	L1	Variety of native language (country)	Father's native language	Mother's native language	Languages spoken at home	Any foreign language?	Foreign language	Proficiency (self-assessment) in foreign language speaking	Proficiency (self-assessment) in foreign language listening	Proficiency (self-assessment) in foreign language reading	Proficiency (self-assessment) in foreign language writing	Proficiency (self-assessment)	Additional foreign language(s)	Proficiency (self-assessment) in additional language speaking	Proficiency (self-assessment) in additional language listening	Proficiency (self-assessment) in additional language reading	Proficiency (self-assessment) in additional language writing	Medium	Task number	Task title	Writing/audio details	Minutes taken to complete the task	Resources used	Text	Original text
Native	EN_WR_18_13_BB	2017	Female	18	Gettysburg College	Psychology and Music	First	English	American English	English	English	English	Yes	""	""	""	""	""	6 / 6	""	""	""	""	""	Written	13	13. Frog	written_online	2	""	"One day I decided to get a pet frog. I placed it into a jar in my room so my mother would not find it. One night I was sleeping and the frog climbed out of the jar and escaped! I woke up next morning and began to panic. Where is my frog?? I searched everywhere in the house and then went outside. ""Frodo, where are you?"" I called. He was nowhere to be found. I searched every rock, tree, bush, and  stick. I accidentally disturbed a deer, who angrily pushed me down a hill. I rolled down the hill and landed in the pond. I heard a croak nearby. Turning, I saw Frodo on a rock nearby. Apparently, Frodo had a family and children, so I decided to leave him alone."	
Native	EN_WR_19_13_MK	2016	Female	19	Pitzer College	Psychology	Second	English	American English	English	English	English	Yes	Spanish	A1 (lower beginner)	A1 (lower beginner)	A1 (lower beginner)	A1 (lower beginner)	6 / 6	""	""	""	""	""	Written	13	13. Frog	written_online	""	""	One day a little boy and his dog brought home a frog in a jar. That night, they went to sleep but the frog jumped out and escaped. The little boy woke up to see the jar was empty. He and his dog went searching for the frog. They searched high and low, and while they were searching they came across a deer. The dear lifted the two up and threw they over the edge of the cliff into a pond. They crawled onto a log near the water and right on the other side of that log they found a family of frogs! They had found their missing frog! They took him back home and waved goodbye to the rest of the frog family.	
Native	EN_WR_19_13_SCJ	2016	Female	19	University of Iowa	International Relations	Junior	English	American English	English	English	English	Yes	Spanish	C1 (lower advanced)	C1 (lower advanced)	C1 (lower advanced)	C1 (lower advanced)	6 / 6	Arabic	A2 (upper beginner)	A2 (upper beginner)	B1 (lower intermediate)	A2 (upper beginner)	Written	13	13. Frog	written_online	""	""	"One day a little boy found a frog in the park. He decided to take it home and call him Fred. While the little boy was sleeping, Fred jumped from the jar and hopped away. The little boy woke up the next morning and could not find Fred. He looked everywhere. The little boy yelled, ""Fred! Where are you? I want you to come home now.""  <br/> The little boy was walking through the forest when all of the sudden a deer attacked him. The little boy flew through the air and landed in the river. His dog saved him and the little boy was thanking his dog when he saw something move in the water. There were tons of little frogs swimming and then he looked up and saw Fred sitting with his wife and eight kids. The little boy was happy Fred found his family again."	
Native	EN_WR_19_13_EC	2017	Female	19	Gettysburg College	Biology	2	English	American English	English	English	English	Yes	Spanish	B2 (upper intermediate)	B2 (upper intermediate)	B2 (upper intermediate)	B2 (upper intermediate)	6 / 6	""	""	""	""	""	Written	13	13. Frog	written_online	3	""	"One day, a boy and his dog lost their pet frog. The boy and the dog went looking for the frog, starting in the back yard. They shouted and howled, ""Frog? Where are you?"", but the frog did not respond. Then, the boy climbed up a tall rock and mistook a deer's antler for tree branches. The deer angrily stood up and bucked the boy off a cliff. He fell a few feet and landed in a stream. After a few seconds, the boy got his bearings and grasped onto a nearby log to pull himself to shore. Upon reaching the shore, he made eye contact with his pet frog- he found it!"	
Native	EN_WR_19_13_HMO	2017	Female	19	Gettysburg College	Mathematical Economics	Freshman	English	American English	English	English	English	Yes	Spanish	B2 (upper intermediate)	B2 (upper intermediate)	C1 (lower advanced)	C1 (lower advanced)	6 / 6	""	""	""	""	""	Written	13	13. Frog	written_online	""	""	One day Joey was sitting in his room with his new pet frog, Jerry, and his pet dog, Spots. Joey was very intrigued by the new frog and enjoyed watching it swim around inside its bowl. Even Spots was paying attention to the mysterious creature in the bowl. Eventually, Joey went to bed. That night, however, Jerry wanted to go see his family back in the pond. So while Joey slept soundly in his bed, Jerry climbed out of the bowl and quietly hopped back to the pond. However, Jerry did not realize that his exit from the bowl made a splashing sound which woke Joey up. Spots had also heard something akin to steps outside his crate downstairs. Spots ran upstairs to check on Joey and the two were perplexed when they looked at the now empty bowl. The next day, they went outside in search of Jerry. Looking through the nearby park and at the edge of the woods, Joey and Spots called out for Jerry but to no avail. Eventually, Joey crawled over a deer with Spots following close behind him. They were both tossed off the deer's head into a pond. As Joey and  Spots emerged from the water, they climbed over a nearby tree trunk. Joey was sad he could not find his new pet. Once they had dried off, though, Joey looked to the side and saw Jerry with his family. Joey realized that Jerry was better off in the wild living with his family.	
Native	EN_WR_19_13_DL	2016	Female	19	Drexel University	Biomedical Engineering	Junior	English	American English	Hokkien, Mandarin Chinese	Cantonese, Mandarin Chinese	English, Mandarin Chinese	Yes	Mandarin Chinese	A2 (upper beginner)	B1 (lower intermediate)	A1 (lower beginner)	A1 (lower beginner)	6 / 6	Korean	A1 (lower beginner)	A1 (lower beginner)	A2 (upper beginner)	A2 (upper beginner)	Written	13	13. Frog	written_online	""	""	"One day, Penny's small human (whose mother called him James) found a Mr. Frog in the storm drain across the street, just before dinner, and brought him home in a glass jar. Penny tried to ask for the gentleman frog's given name in her most polite voice, but James reproached Penny for barking and seemed content to spend the evening without even attempting conversation, so Mr. Frog suffered through a most improper silence until James' bedtime.  <br/> It was the middle of the night, and a gentle breeze was wafting through the open window, when Penny heard a soft, reedy voice from the windowsill:  <br/> ""Pardon this unmannerly exit, ma'am,"" whispered Mr. Frog, ""but I really must be getting home to my family."" <br/> Penny nodded briefly, not wanting to wake James, and the gentleman frog disappeared into the night.  <br/> The next morning, James was distraught to find Mr. Frog missing from his glass jar, despite Penny's reassurances that their guest was really all right.  <br/> ""Where did he go?"" cried James. ""What if he is lost in the forest?"" <br/> ""Mr. Frog went home to his family,"" said Penny. <br/> ""Oh, don't bark, Penny,"" said James. ""I know you must be worried, but we'll find him and bring him home."" <br/> ""He's already home,"" said Penny.  <br/> ""Shh, Penny,"" said James.  <br/> Since James could not be convinced of Mr. Frog's safety, Penny's only choice was to accompany her human into the forest in pursuit of their recent guest. Like most humans, James went about making an unbelievable amount of noise, calling for ""Froggy!"" incessantly and stepping on every loud twig that could possibly lie in his path. <br/> ""I rather think 'Froggy' is a disrespectful moniker,"" said Penny. ""Also, oughtn't we check the pond first?"" <br/> ""That's right, girl,"" said James. ""You call for Froggy too! Keep barking!"" <br/> ""What izz your human doing, what izz he looking for?"" asked several bees from a nearby hive. <br/> ""We had a run-in with a gentleman frog last night; I didn't catch his name,"" Penny explained. ""My human seems intent on finding him again, though I'm not sure he knows where to look."" <br/> The commotion brought Tom Weasel wiggling out of his house to laugh uproariously at the sight of James calling into the hollows of Owl Tree. <br/> ""Does your human know ANYTHING about animals?"" said Tom, wheezing with laughter. ""All he's going to get out of that is a very angry Mrs. Owl - she's just gone down for a nap, just watch - "" <br/> Sure enough, Virginia Owl soon appeared in her tree's branches, although James had since moved on to the large rock at the front door of another house. One of Virginia's eyes was still closed, and her beak was downturned in a fantastically sleepy scowl. She took a deep breath.  <br/> ""WHO,"" bellowed Virginia. She paused to yawn. ""WHO dares -"" <br/> ""FROGGY WHERE ARE YOU?"" yelled James.  <br/> Tom snickered so loudly that Penny took it upon herself to forcefully remind him of his manners, and as such, almost missed the sudden hush that swept through the whole clearing. Even James fell silent, which was sufficiently strange for Penny to go immediately running to her human's side, but she found him sprawled helplessly over Sir Roland Buck's wide face and rising steadily as the buck stood up.  <br/> ""Oh, for the love of all good creatures in this forest,"" said Sir Roland in his slow, rumbling way.  <br/> ""Sir, I apologize,"" yelped Penny. ""My human - "" <br/> ""Yes, yes,"" said Sir Roland, while James clung to his antlers, terrified. ""Come along.""  <br/> It turned out that the pond was much closer than Penny remembered from her last trip to the forest, which was comforting. She did think that Sir Roland could have dropped her and James off in a less literal fashion, though."	
Native	EN_WR_19_13_AMW	2016	Female	19	Whitman College	Psychology	2	English	American English	English	English	English	Yes	Spanish	B1 (lower intermediate)	B1 (lower intermediate)	B2 (upper intermediate)	B2 (upper intermediate)	6 / 6	""	""	""	""	""	Written	13	13. Frog	written_online	""	""	There was once a little boy who had a pet frog that he kept in a jar. One night, when the boy went to sleep, his frog climbed out of the jar. When the boy awoke, he was distressed when he noticed the empty jar. Where could his frog have gone? He looked everywhere for his pet frog -- he yelled his name in the forest, looked for him in a tree and on top of a boulder.	
Native	EN_WR_20_13_RW	2016	Female	20	University of Rochester	Mechanical engineering	Junior	English	American English	English	English	English	Yes	German	A2 (upper beginner)	A2 (upper beginner)	A1 (lower beginner)	A1 (lower beginner)	6 / 6	""	""	""	""	""	Written	13	13. Frog	written_online	""	""	One day, little Garrett sat and admired his frog. Oh how he loved that frog. He went to sleep dreaming of playing with his frog. But the mischievous frog saw a fly buzzing past and hopped out of his bowl to chase it! When little Garrett woke up he was distraught over his missing frog. He searched high and low for his dear frog, all over the nearby forest. He was just starting to despair when he flopped over onto a log. Suddenly, a large deer pushed him over a waterfall and he fell into the river with a great splash! What was that for? He angrily thought. But look, over there! His dear little frog happily munching on flies. Little Garrett was overjoyed at finding his frog.	
Native	EN_WR_20_13_LP	2017	Female	20	Gettysburg College	Music and Health Sciences	sophomore	English	American English	Polish	English	English	Yes	Spanish	B2 (upper intermediate)	C1 (lower advanced)	C1 (lower advanced)	B2 (upper intermediate)	6 / 6	Chinese	A2 (upper beginner)	A2 (upper beginner)	A2 (upper beginner)	A2 (upper beginner)	Written	13	13. Frog	written_online	5	""	One day a boy brought home a frog and his pet dog was very interested in the new creature. That night when the boy went to bed to frog became a little curious so he climbed out of his bowl. The next morning when the boy woke up, he and his dog both realized that the frog was no longer in his bowl. They searched all through out the woods trying to find the lost frog. They looked behind trees, under rocks, and even near a bee hive. When the boy when to look over the edge of a large rock, he thought he was leaning on branches but was actually leaning up against a deers antlers. The deer threw the boy and his dog over the edge of the cliff and into the water below. The boy and his dog climbed out of the water soaking wet. Then, to their surprise, they found the frog sitting with his family and took his away from them.	
Native	EN_WR_20_13_SS	2016	Female	20	University of Rochester	Brain and Cognitive Science	Junior	English	American English	English	English	English	Yes	Hebrew	B2 (upper intermediate)	C1 (lower advanced)	C1 (lower advanced)	B2 (upper intermediate)	6 / 6	""	""	""	""	""	Written	13	13. Frog	written_online	""	""	One day my dog and I caught a frog out in the woods. I kept him in a jar next to my bed, but I didn't put a lid on so that he could breathe. He escaped while we were asleep! I looked everywhere for my beloved frog, but he wasn't in my room. He wasn't in the field where I caught him. I climbed trees and rocks looking for him, but he was nowhere to be found. While I was climbing a boulder a deer scared me! (I think I scared it too...) I fell off of a small ledge, and into a pond. The water was cold, but I'm a good swimmer so I wasn't worried. As I lay on a log to dry off, my dog started barking. On the other side of the log was my frog! A few more frogs started making noises at me when I picked my frog up. They must have been his family! I knew I would be upset if someone tried to take me from my family, so I tried to put him back down. The frog jumped back up into my hand. He wanted to come with me! My frog said goodbye to his family and the three of us went home together.	
Native	EN_WR_20_13_AMS	2016	Female	20	University of Rochester	epidemiology	Junior	English	American English	English	English, Polish	English, Polish	Yes	Spanish	B2 (upper intermediate)	B1 (lower intermediate)	B1 (lower intermediate)	B2 (upper intermediate)	6 / 6	French	B1 (lower intermediate)	B1 (lower intermediate)	B2 (upper intermediate)	B1 (lower intermediate)	Written	13	13. Frog	written_online	""	""	One day, a small boy decided to catch a frog and keep it in a jar.  The frog was not a fan of this living arrangement and escaped while the boy and his dog slept. In the morning the child and dog went to go look in the forest for the frog.  They startle a deer and are pushed into the river, but manage to climb onto a log.  While sitting on the log, the boy and his dog see the frog that was abducted earlier.  The boy realizes that the frog has a family and that he was terribly wrong to try and take them away, so he waves goodbye and leaves with his dog.	
Native	EN_WR_20_13_MPG	2016	Female	20	Sarah Lawrence College	Foreign language	Junior	English	American English	English	English	English	Yes	Japanese	B2 (upper intermediate)	B2 (upper intermediate)	B2 (upper intermediate)	B2 (upper intermediate)	6 / 6	Spanish	A2 (upper beginner)	A2 (upper beginner)	A2 (upper beginner)	A2 (upper beginner)	Written	13	13. Frog	written_online	""	""	"One day a little boy and his dog caught a frog put it in a glass jar. They brought the frog up to his room and went to bed looking forward to the adventures they would have the next day together. But, when the dog and boy woke up the next morning the frog was gone! ""Oh no!"" said the boy to his dog. ""We must go find him!"" So the boy and his dog went outside to look for the frog. They looked high and low, but they could not find the frog. ""What if we never see him again?"" the boy cried.  Finally, after searching all day, the boy and his dog reach the bank of a little pond in the middle of the woods. And there, sitting next to his family, was the frog! He croaked happily as if to say ""Hello!""  The boy and his dog we're very happy that they had found their friend again. They came back many times to play with the frog. The end."	
Native	EN_WR_20_13_CP	2016	Male	20	Haverford	Political Science	Junior	English	American English	English	English	English	Yes	Spanish	B2 (upper intermediate)	B2 (upper intermediate)	B2 (upper intermediate)	B2 (upper intermediate)	6 / 6	""	""	""	""	""	Written	13	13. Frog	written_online	""	""	One day Johnny and his dog were playing with their new friend Froggy. After a long day and lot's of fun, they all went to bed. The next morning, Johnny woke to find that Froggy was missing! They looked all over the forest, in logs and around bushes. They even met a buck who was not very nice and pushed them off a ledge into the creek. But when they looked around in the creek, they saw Froggy! And he had a friend with him.	
Native	EN_WR_20_13_JC	2016	Female	20	University of Rochester	History, English	Junior	English	American English	Romanian	Romanian	English, Romanian	Yes	Romanian	B2 (upper intermediate)	C2 (upper advanced)	A2 (upper beginner)	A1 (lower beginner)	6 / 6	""	""	""	""	""	Written	13	13. Frog	written_online	""	""	"One day a boy found a frog and captured it in a jar. While the boy was asleep that night the frog had managed to jump out of the jar and escape. When the boy woke up the next morning he was sad to find his new friend had disappeared. So he set out with his dog, Rufus, to search for the frog. The boy went through valleys and called ""Here frog, frog, frog, frog!"". He then entered into the forest. He climbed high in the trees, and on top of rocks, searching in every nook and cranny for the little frog. While searching on top of the rock the boy had stumbled across a deer. The deer was not happy to see an imposter in his territory. He picked the boy up with his head and flung him and the dog into the shallow river below. Rufus and the boy quickly scrambled away. While climbing over a log, they came upon a frog family. The boy recognized his frog as one of them. Seeing the frog amongst his family made the boy realize that he could no longer take him home with Rufus. So the boy waved goodbye to his friend and hope to visit him again soon."	
Native	EN_WR_20_13_SPB	2016	Male	20	University of Rochester	Computer Science	Junior	English	American English	English	English	English	Yes	Spanish	A2 (upper beginner)	A2 (upper beginner)	B1 (lower intermediate)	A1 (lower beginner)	6 / 6	Hebrew	A1 (lower beginner)	A1 (lower beginner)	B1 (lower intermediate)	A1 (lower beginner)	Written	13	13. Frog	written_online	""	""	One day, a boy and his dog caught a frog while playing outside. He found a jar and put the frog there, but, the frog, being a frog, did not like being imprisoned in the jar. So he hatched a scheme to wait until all his wardens retired to bed, when he would escape into the night and continue his life as a frog. when the boy woke up, he had found that his prisoner had escaped so he went on a frog-hunt. In his searches he found a karmic dear that saw into his soul and saw how he had cruelly imprisoned that frog. So to teach him a lesson, the dear kidnapped the boy and his dog and threw them in a woodland prison of the dear's own creation. It is there that the boy lived out the rest of his days as a prisoner of nature.	
Native	EN_WR_20_13_LH	2016	Female	20	University of Rochester	BCS	Junior	English	American English	English	English	English	Yes	Spanish	B1 (lower intermediate)	C1 (lower advanced)	C1 (lower advanced)	C1 (lower advanced)	6 / 6	""	""	""	""	""	Written	13	13. Frog	written_online	""	""	One day a boy brought a frog home. When he was sleeping the frog escaped. The boy and his dog went looking for the frog. A moose pushed the boy over a cliff and he feel into a pond, where he found the frog with his frog family.	
Native	EN_WR_21_13_JD	2016	Female	21	University of Rochester	History	Junior	English	American English	English	English	English	Yes	Spanish	A2 (upper beginner)	B1 (lower intermediate)	B2 (upper intermediate)	B1 (lower intermediate)	6 / 6	""	""	""	""	""	Written	13	13. Frog	written_online	""	""	One day, young Timothy and his dog, Patrick, caught a frog at the pond down the street from Timothy's house. They brought him home and put him in a glass jar at the end of Timothy's bed.  <br/> That night, however, unbeknownst to Timothy or Patrick, the frog escaped! Saddened by this turn of events, Timothy decided to return to the forest where he had found the frog and bring him back. <br/> Timothy and Patrick wandered the forest for several hours, Timothy calling for his small friend to come home and Patrick trying to smell for the frog.  <br/> As Timothy climbed a rock beside a set of barren branches, trying to call for the frog, the branches shifted and Timothy realized that they were not branches at all. In fact, Timothy was holding onto a young buck! <br/> The buck did not care for Timothy's manhandling at all, and he twisted his large head, sending Timothy tumbling down a small drop into a pond. <br/> Patrick, ever a good dog, leapt after Timothy and helped him swim to safety outside the water. Timothy was sad now, fearing he would never find the frog now.    <br/> Suddenly he heard a loud croak, and Timothy turned to see the very frog that he was searching for! However, the frog was not alone. The frog had a partner and several smaller frogs with it. Timothy realized that he should not have taken the frog from his proper habitat and family, and he resolved to leave the reptile alone with its family to live out its life in the pond.	
Native	EN_WR_21_13_MTH	2016	Male	21	University of Rochester	Biochemistry	Junior	English	American English	English	English	English	Yes	German	A2 (upper beginner)	A2 (upper beginner)	A2 (upper beginner)	A2 (upper beginner)	6 / 6	""	""	""	""	""	Written	13	13. Frog	written_online	""	""	One day, a boy captured a frog. In the middle of the night, the frog snuck out and ran off on the boy. He went to go find the frog with his best friend, his loyal dog. They searched high and low through the forest, but could not find the frog. They had almost given up when the young boy fell off of a cliff into a lake, and found the frog. He had gone back to be with his family! The boy saw all the baby frogs, and he was very happy.	
Native	EN_WR_21_13_JDC	2016	Male	21	University of Rochester	Classics	Junior	English	American English	English	English	English	Yes	Latin	A2 (upper beginner)	B1 (lower intermediate)	C1 (lower advanced)	B1 (lower intermediate)	6 / 6	""	""	""	""	""	Written	13	13. Frog	written_online	""	""	One day a boy took off the lid of his frog jar to let his frog breath at night. But the frog escaped as he slept! The boy was very worried about his frog when he woke to find it missing, so he and his dog went on a search for the frog. They looked high and low, climbing over many obstacles and avoiding dangers. The boy disturbed a buck in the woods and, startled, the buck pushed him off of a ledge into a pond. Splash! The boy's dog pulled him from the water. Just as they were giving up on their search to go home, the boy spies his frog with a family on a log, and the boy is happy.	
Native	EN_WR_21_13_SY	2016	Female	21	University of Rochester	Ecology and Evolutionary Biology	Senior	English	American English	English	English	English	Yes	Spanish	A2 (upper beginner)	B1 (lower intermediate)	B1 (lower intermediate)	A1 (lower beginner)	6 / 6	American Sign Language	B2 (upper intermediate)	B2 (upper intermediate)	C2 (upper advanced)	C2 (upper advanced)	Written	13	13. Frog	written_online	""	""	One day, a boy and his dog were playing with their frog. During the night, the frog got out so the boy and his dog decided to look for it. They looked everywhere until the boy accidentally angered a deer. The deer took them and dumped them into a creek. Upon swimming to shore and climbing onto a log, they found the frog! The frog had started a family so, with smiles on their faces, the boy and his dog left the frog on the log with its family.	
Native	EN_WR_21_13_AGS	2016	Male	21	Colorado College	sociology	3rd year/ junior	English	American English	English	English	English	Yes	Spanish	C1 (lower advanced)	C1 (lower advanced)	C1 (lower advanced)	B2 (upper intermediate)	6 / 6	""	""	""	""	""	Written	13	13. Frog	written_online	""	""	One day, a boy and his dog has a frog in a jar. In the dark of the night, the frog escaped, with its powerful legs. in the morning the boy woke up perplexed, the jar was empty, the frog had gone! So boy and his dog went searching outside, he called through the forest but just could not find the frog in the tree, the frog on a rock, but the stick he was leaning on started to walk! the boy fell forward on the nose of a deer, and the deer quickly dumped him into a river, and boy and his dog will never forget how awfully, dreadfully, terribly wet they had gotten when suddenly behind from a log as rotten as possible out came a frog! Boy and his dog had encountered their friend, but realized froggy had run from their bed because froggy had family just like the boy, so they left little froggy in his home filled with joy.	
