Native	EN_WR_21_13_SWS	2016	Male	21	Pennsylvania State University	International Politics and Psychology	Senior	English	American English	English	English	English	Yes	Italian	B1 (lower intermediate)	B1 (lower intermediate)	B1 (lower intermediate)	B1 (lower intermediate)	6 / 6	""	""	""	""	""	Written	13	13. Frog	written_online	""	""	"One day, Joe caught a frog. He put it in a jar in his bedroom, and after looking at it for a while he went to sleep. When he woke up, it was gone. Saddened by its absence, he went to search for it in the forest with his dog. He searched high and low without success, until a wild elk knocked him and the dog off an escarpment into a lake. He climbed out, drenched and depressed, and ready to go home. Then, he heard a ""ribbit"" from behind a log. He climbed over it, and saw the frog with another frog and a bunch of smaller frogs. He suddenly realized that he'd taken the frog from the wild without wondering whether the frog had a family, and he left the frog in peace."	
Native	EN_WR_21_13_HJ	2017	Female	21	Pennsylvania State University	Biochemistry	Junior	English	American English	English	English	English	Yes	Spanish	A1 (lower beginner)	A2 (upper beginner)	B1 (lower intermediate)	A2 (upper beginner)	6 / 6	""	""	""	""	""	Written	13	13. Frog	written_online	20	""	One day, little Tommy sat admiring the slimy, green frog that he found at the park earlier that day. It's big eyes bulged and a low sound reverberated deeply in it's belly every so often. With a smile, Tommy dubbed the frog Samuel. Since Tommy had quite a long day, it was time for him to go to bed. He said goodnight to Samuel in his glass jar, and tucked himself into bed. Early the next morning, little Tommy awoke to find Samuel's jar was empty. His lips drooped into a frown as he realized that the frog must have escaped during the night. Tommy threw on his clothes from yesterday that were strewn about the floor, and ran out the door on the hunt for his new friend. He searched the park high and low, calling out Samuel's name every so often. Tommy searched the trees, but alas there was only a hive of bees. As he was peering into the bushes, he felt something move beneath him. All of a sudden, Tommy was lifted high into the air on his belly, a massive buck beneath him. The buck was very unhappy to find Tommy perched upon his head, so he tossed him off, Tommy landing in the pond nearby with a splash. Sputtering, he sat up, pushing his wet hair out of his eyes to reassess his surroundings. It was then that he heard a croak. Tommy immediately thought of Samuel and began to search the pond's surroundings. Not a minute went by before another croak was issued from behind a large log. Tommy rounded the corner, and to his surprise not only saw Samuel, but an entire family of frogs. This must be Samuel's wife and kids, Tommy thought. He decided that Samuel would be much happier here with his family than in the jar that Tommy had for him at home. With this bittersweet knowledge, Tommy said farewell to his new friend and headed home after promising to visit him often. Even though Tommy knew he couldn't raise Samuel as his own, he was still happy to know that the frog was safe and with his family.	
Native	EN_WR_21_13_LC	2016	Female	21	Wofford College	Biology and Spanish	Senior	English	American English	English	English	English	Yes	Spanish	C1 (lower advanced)	C1 (lower advanced)	C1 (lower advanced)	C1 (lower advanced)	6 / 6	""	""	""	""	""	Written	13	13. Frog	written_online	""	""	"One day, a little boy came home to find that his parents had brought him a pet frog. He brought the frog in his jar to his room and spent all afternoon watching the frog with his pet dog. The frog was afraid of the dog and didn't much like his jar, so he hatched a plan of escape. That night, while the boy and the dog were sleeping, the frog climbed out of the jar and hopped away. When the boy woke up, he realized that his frog had gone missing. He was in a panic and immediately turned the house upside-down in search. The boy realized that the frog must not be in the house, so he and his dog went outside to search. They called for the frog into the woods, ""Frog! Frog, where are you?"" but he didn't come back. The boy and the dog headed into the forest to search. High and low, left and right, in a tree, on a rock- the two searched everywhere. The boy just couldn't find his frog. He did, however, find a new animal: a huge buck. The buck didn't like the boy's intrusion into his territory, and rapidly threw him over a short ledge. The boy and his dog landed with a thud in a soft march. When he got up and brushed himself off, the boy noticed a whole family of frogs watching him curiously. Among them he saw his pet frog. He had found him! His pet, touched that the boy had gone through so much to find him, decided to go back home with the boy and his dog. They waved goodbye to the frog family and trekked back home, where the three became great friends and lived HOPpily ever after."	
Native	EN_WR_21_13_AG	2016	Female	21	Wheaton College	Psychology	Junior	English	American English	English	English	English	Yes	""	B2 (upper intermediate)	B1 (lower intermediate)	B2 (upper intermediate)	B2 (upper intermediate)	6 / 6	""	""	""	""	""	Written	13	13. Frog	written_online	""	""	One day Eleanor was out in the woods with her dog, Buster. The two enjoyed following the stream behind their house pretending to be famous explorers, or pirates, or spies. They would sometimes get lost in their imaginary games for hours. One day in the middle of the summer as Eleanor and Buster were looking for dragon eggs in a calm pool on the edge of the river a frog hopped right onto Eleanor's shoulder. Eleanor was enchanted with her new friend, who spoke to her about life as a frog and how he had traveled all the way down the stream to the Big Pond and there were pirates in the big pond. Buster was dubious about trusting the Frog, and he was a little jealous of the interest Eleanor had her new friend. He made it clear that he was not interested in being the Frog's friend. Eleanor invited the Frog up to her house for a sleep over. She prepared his bowl and fed him a big supper. Buster, was still not delighted by the Frog's presence. He did not believe that the Frog had ever been down to the Big Pond or that there were pirates there. Once Eleanor fell alseep the Frog decided to leave. While he enjoyed Eleanor's company, he felt like Buster didn't like him. When Eleanor and Buster woke up and the Frog was gone Eleanor became worried that the Frong was kidnapped. She insisted that Buster come with her to help her find the Frog. Buster was reluctant but goes along to support his best friend. The two went further down the stream than they have ever been. They saw strange new animals, and felt a little afraid when they didn't recognize where they were. The area was all new, but Eleanor insisted that finding the Frog is essential. Eventually Eleanor decided to stop and rest on top of a little ledge. She saw some black berries and went to reach for them, but suddenly she found herself on top of a deer. The deer was so startled that he flicked his head and she went flying into a body of water. Buster jumped in right after her. When they resurfaced they realized that they must be in the Big Pond. The Frog noticed the disruption from the other side of the pond and swam over immediately to investigate and help out. The three realized what had happened and were simultaneously irritated and touched. The Frog apologized for being rude and not leaving a note and lying about the pirates. He said that he would be lucky to have Eleanor and Buster as his friends. Buster apologized for not being nice to the Frog. Eleanor forgave Buster for being grumpy, and the Frog for exaggerating the truth.	
Native	EN_WR_22_13_SW	2017	Female	22	Pennsylvania State University	Psychology	Senior	English	American English	English	English	English	Yes	""	""	""	""	""	6 / 6	""	""	""	""	""	Written	13	13. Frog	written_online	2	""	"One day I captured a frog while outside playing. Mama and Papa told me that I could keep the frog in a mason jar, but I had to keep the top on it. That night my dog whiskers and I, watched the frog leap around in the jar before saying good night.The next morning I woke up and the frog was gone. I began to search everywhere. ""Frog"", I shouted in the valley, but I did not hear ""Ribbit"" back. I climbed up the trees and climbed on some rocks, but Frog seemed to have disappeared."	
Native	EN_WR_22_13_ES	2016	Female	22	DePauw University	Spanish/English Writing	Senior	English	American English	English	English	English	Yes	Spanish	C1 (lower advanced)	C1 (lower advanced)	C1 (lower advanced)	C1 (lower advanced)	6 / 6	""	""	""	""	""	Written	13	13. Frog	written_online	""	""	One day my frog escaped. I put him in a jar by my bed but he must have gotten out. I searched for him everywhere. First I searched my room. Then I searched outside. My dog even helped, but we could not find him.	
Native	EN_WR_22_13_RFF	2017	Male	22	Pennsylvania State University	Accounting	4	English	American English	English	English	English	Yes	Spanish	B1 (lower intermediate)	B2 (upper intermediate)	B2 (upper intermediate)	B2 (upper intermediate)	6 / 6	""	""	""	""	""	Written	13	13. Frog	written_online	1	""	One day, a boy and his dog were watching his pet frog. After playing with the frog for a while, the boy went to bed. While the boy was sleeping, the frog got up and jumped out of his bowl and went away. When the boy awoke the next morning, he was very sad to find out that the frog wasn’t there anymore. To try and cheer himself up, he went out looking for the frog. He went out to his backyard, but he couldn’t find the frog there. He went and searched the forest, but he also couldn’t find the frog there. To get better ground, he stood on top of a rock to shout for the frog. When he shouted the first time, a mean and evil deer scooped the boy up and threw him into a river, knocking the boy out. Upon waking up, the boy gathered his surroundings and propped himself up on a log. Looking around, he noticed some new animals he has never seen before, like a squirrel.	
Native	EN_WR_22_13_MTP	2017	Female	22	UDC	ENGLISH	1ST	English	British English	Spanish	English	English, Spanish, Galician, Catalan	Yes	Spanish	C2 (upper advanced)	C2 (upper advanced)	C2 (upper advanced)	C2 (upper advanced)	6 / 6	Galician	C1 (lower advanced)	C2 (upper advanced)	C2 (upper advanced)	B2 (upper intermediate)	Written	13	13. Frog	written_online	35	Monolingual dictionary, Spellchecker, Internet, Background readings about the task topic (newspapers, internet, TV, etc.)	"""Frog, where are you?"" <br/>  <br/> One day, Pete and his stubby little dog Albus brought home a frog they had found earlier that day in St. Mary's Park. Before going to bed, Pete put the frog in an empty jam jar, to examine it the following morning. In the middle of the night, the frog whom Pete decided to name Clementi, found it's way out of the jar and bounced his way back to the park. The moment the sun came out, Pete anxiously got up to greet his new little friend, and maybe feed him some delicious breakfast flies, but to his horror little Clementi was no longer there. Pete quickly got dressed and him and Albus followed the trail back to park were they had found Clementi. They looked for him everywhere. As Albus howled across the wildflower fields, Pete shouted  ""Clemeti, Clementi where are you, you toad?"", but the only ones that replied where the noisy black sparrows that flew off slightly annoyed.  <br/> Clementi wasn't in a hole in a tree either, and he wasn't near the beehive that clumsy Albus knocked down... Pete was about  to give up, when he decided to climb a big rock to see if he could spot him from up high. He repeated his howl, ""Clemeti, Clementi where are you, you  frog?"". Suddenly a deer leaped from behind the rocks and pushed Pete and poor Albus of a cliff. They both fell and  plunged to a shallow pond. Albus dragged drowsy Pete so he could latch on to a floating hollow log,  which was quite unnecessary since the pond was barely five inches deep. Pete regained consciousness thanks to the slobberness of Albus's incessant lick. Slowly, a blurry image became clear, and Pete now took notice on what he had in front of him. A big Papa frog, next to it a smaller Mama frog and half a dozen baby frogs, all staring at him with their big squishy eyes. Pete realized Papa frog was his lost friend Clementi, except he was no longer lost. He had returned home to the empty log where he and his family lived. Pete felt sad to leave his friend behind, but knew he was much needed at home with his family. Albus and Pete set themselves off their way back home, as Clementi began to sing. Joined by the rest of his family, they choired a tune goodbye.  <br/>  <br/> The End."	
Native	EN_SP_22_13_RFF	2017	Male	22	Pennsylvania State University	Accounting	4	English	American English	English	English	English	Yes	Spanish	B1 (lower intermediate)	B2 (upper intermediate)	B2 (upper intermediate)	B2 (upper intermediate)	6 / 6	""	""	""	""	""	Spoken	13	13. Frog	spoken_online	1	""	one day a boy and his dog were watching his pet frog / after playing with the frog for a while the boy went to bed / while the boy was sleeping the frog got up and jumped out of his bowl / and went away / when the boy awoke the next morning he was very sad to find out / that the frog wasn't there anymore / to try and cheer himself up he went out looking for the frog / he went on to his backyard but he couldn't find the frog there / he went out and searched the forest but he also couldn't find the frog there / to get better ground he stood on a rock / on top of the rock just shout for the frog / when he shouted the first time it made an evil deer scoop the boy up and threw him into the river / knocking the boy out xxx waking up the boy gathered his surroundings and prompted himself a paddle log / looking around he notices some new animals he has never seen before / like a squirrel	
Native	EN_SP_22_13_VG	2017	Female	22	PSU Ling 521	Cognitive Psychology	first year graduate student	English	American English	English	English	English	Yes	""	""	""	""	""	6 / 6	""	""	""	""	""	Spoken	13	13. Frog	spoken_online	1	""	one day the little boy and his dog were looking at a frog in a glass jar before they went to bed / then the boy went to sleep the frog was able to escape his glass jar and run away / uh the next day the boy and his dog were really sad because they lost the frog / they decided to go look for him everywhere in the woods / and he was calling for the frog and looking for him / they climbed the trees and looked everywhere in the woods / climbed over rocks / and / then / when the boy was looking a deer came out of nowhere and pushed the boy off a cl= and his dog off a cliff / he fell into a pond / and was and him he and his dog / were able to get out of the pond / and climb / over a log / then / the boy found his frog and realize that his frog has a family / and he left the frog in the woods / by the pond with his family and he and his dog went home	
Native	EN_WR_23_13_RS	2017	Female	23	Pennsylvania State University	Architecture, International Studies	Senior	English	American English	English	English	English	Yes	Spanish	A2 (upper beginner)	B1 (lower intermediate)	B2 (upper intermediate)	B1 (lower intermediate)	6 / 6	""	""	""	""	""	Written	13	13. Frog	written_online	10	Spellchecker	One day the little Boy and his Dog found a friend, Frog. They placed their new friend in a glass home and went to sleep for the night. However, Frog didn't like his bowl. He snuck outside of his glass home while Boy and Dog slept. In the morning Boy and Dog were shocked to find Frog has disappeared. The searched high and low for their new friend. In the meadow, the forest, on the rock. They rand into their friend deer, who helped them along for awhile. Suddenly, Boy and Dog fell off a ledge and into the pond below. As they climbed out of the pond and over the log, they saw something they never expected. They found Frog. Frog was smiling, surrounded by his wife and children. Boy and Dog realized why Frog had left them. They would miss their friend, but Frog needed to be with his family. With big smiles, Boy and Dog waved goodbye and began the long walk home.	
Native	EN_WR_24_13_BH	2017	Female	24	Durham Univeristy	Classics	Graduated	English	British English	English	English	English	Yes	Spanish	B2 (upper intermediate)	B2 (upper intermediate)	C1 (lower advanced)	B1 (lower intermediate)	6 / 6	""	""	""	""	""	Written	13	13. Frog	written_online	""	""	One day, a young boy named Tommy with his adventurous and trusty dog Chewbaca discovered a frog. The frog looked lost and helpless and Tommy wished to help him. Carefully scooping the frog up, he popped him in the pocket of his coat and treaded home, Chewbaca leading the way. Tommy named the frog Freddie and cared for him well, ensuring that Freddie was well fed. Tommy tucked Freddie up in a glass bowl for the night, himself climbing into his bed where Chewbaca settled at his feet.  <br/> As the moon rose, Tommy and Chewbaca slept soundly, breathing deeply. However, Freddie had other ideas. Stretching his legs gently, he climbed up and out of the glass bowl that had served as his bed and gingerly crept out of Tommy's room, down the corridor, down the stairs and out of the door.  <br/> On awakening, Tommy and Chewbaca realised with a jolt that Freddie's glass bowl was empty. Throwing on his coat and wellies, Tommy charged out of the house, with Chewbaca hot on his heels. Tommy was worried that Freddie would get lost, or even worse, eaten! Tommy shouted; Chewbaca howled. Tommy climbed up into a tree for a better view; Chewbaca scrabbled. They climbed, they crawled, they trip-trapped over streams, and they got into all sorts of scrapes! Tommy and Chewbaca were causing so much of a racket in the quiet wood that other animals came out to see what the fuss was about. One particularly disgruntled elk even barged Tommy off a rock and Tommy landed splash into the stream! Fortunately, Tommy wasn't hurt and was guarded from further harm by Chewbaca. Then, over the trickle of the stream and the gentle rustling of the wind, Tommy and Chewbaca heard a croak. And then another croak. And another. Tommy and Chewbaca poked their heads over the log next to the stream and to their surprise saw not only Freddie but his family! Tommy and Chewbaca were delighted to find Freddie and to see that he was reunited with his loved ones. Tommy and Chewbaca hugged Freddie and waved goodbye, happy to head on to their next adventure.	
Native	EN_WR_25_13_JR	2017	Female	25	University of Oxford	English Lang. and Lit.	""	English	British English	English	English	English	Yes	Spanish	B2 (upper intermediate)	B2 (upper intermediate)	B2 (upper intermediate)	B2 (upper intermediate)	6 / 6	""	""	""	""	""	Written	13	13. Frog	written_online	""	""	One day Charlie found a frog when playing in the woods. It was green and speckled with grey and brown, and its skin glistened in the dappled sunlight of the woods. Charlie was entranced, and couldn't wait to get the frog home to show his friends.  <br/> When he got home, and the frog sat in the jam jar staring at him, Charlie felt put out. Its magic had dissipated- now that its surroundings were normal, the frog looked out of place, and far from home. Its skin was too green, too speckled, it glistened too much for the dry ordinariness of Charlie's bedroom.  <br/> When Charlie woke up the next morning, he was shocked to find the frog was gone. For a second he was relieved, thinking it must have found its way back to its forest home. Then he looked in fear at his dog, and realised with a gulp how big Spot must look to the poor little frog.  <br/> Charlie looked high and low, but he couldn't find the frog anywhere. He looked under the stairs, in his garden, up a tree, behind a rock- everywhere! All the while he was calling to the frog, 'I'm so sorry! I'm so sorry Frog!', desperately hoping for a conciliatory 'ribbit' in reply. There was only silence.	
Native	EN_WR_27_13_JJ	2017	Male	27	St. Edward's University	Finance	2012	English	American English	English	English	English	Yes	Spanish	A1 (lower beginner)	A1 (lower beginner)	A1 (lower beginner)	A1 (lower beginner)	6 / 6	""	""	""	""	""	Written	13	13. Frog	written_online	15	""	One day, Jimmy brought a frog home from the pet store. He sat in his room with his puppy, staring in amazement, and decided to name him Bud. When Jimmy finally went to bed and shut his eyes, Bud decided to make a run for it, quietly escaping through the window without making a sound.  <br/>  <br/> Jimmy woke up terribly disappointed to find Bud missing, but he and his puppy were determined to go look for him. They looked high and low, in trees and in the bushes, only to find nothing. Then Jimmy  found a tall rock and began screaming Bud's name at the top of his lungs, even though he knew Bud wouldn't understand him.  <br/>  <br/> Jimmy leaned on what he thought was a stick so he could get his balance on top of the rock, but little did he know, he was actually grabbing onto the antlers of a buck. The buck pulled his head away sharply, throwing Jimmy into the small pond about 6 feet below. He landed roughly in the water, but wasn't really phased by the fall.  <br/>  <br/> As he sat up on a nearby log, he peeked over behind and couldn't believe his eyes. There he was. Bud and his entire frog family grinning as wide as can be. <br/>  <br/> Jimmy looked at Bud and could tell how much happier he was now that he was back in the creek with his family. So, Jimmy emotionally bid farewell and went home, leaving Bud and his family in the creek where they could live happily ever after.	
Native	EN_WR_27_13_SM	2017	Female	27	Texas Woman's University	Doctor of Physical Therapy	2	English	American English	English	Spanish	English	Yes	""	""	""	""	""	6 / 6	""	""	""	""	""	Written	13	13. Frog	written_online	2	""	One day a boy and his dog said good night to their pet frog. In the morning, he realized the frog had gone missing. He searched all over for his pet frog, and could not find him. He went into the woods to look for his pet frog. He climbed on top of a rock and leaned over into some branches in search of that darn frog. Suddenly, he was startled by what he thought to be branches but instead it was a  Deer! He fell off the rock into a pond. He climbed out of the pond with his dog at his side and found a family of tiny frogs! The mom, dad and baby frogs all in a row. He picked one up said goodbye to the family and started on his way home with his new pet frog.	
Native	EN_SP_28_13_KRK	2017	Female	28	PSU LING 521	German and Language Science (PhD)	1	English	American English	English	English	English	Yes	German	C2 (upper advanced)	C2 (upper advanced)	C2 (upper advanced)	C2 (upper advanced)	6 / 6	French	B1 (lower intermediate)	B1 (lower intermediate)	B1 (lower intermediate)	B1 (lower intermediate)	Spoken	13	13. Frog	spoken_online	1	""	one day / a little boy found a frog and he brought it back to his room / he put it in a jar / next to his bed / uh and he and his dog looked at it / then he went to bed / while he was sleeping / the frog escaped from the jar / the frog climbed out of the jar and when the little boy and his dog woke up in the morning / the frog was no longer in the jar / so they went to look for the frog / the boy and his dog they looked in the woods / they looked next to a beehive and in a tree / they looked on top of a rock / and under a rock / and then the boy grabbed what he trought it was a branch / but it was actually the antler of a deer / and then / the boy uh / was on top of the deer and then he then fell off / of a little cliff with his dog and he fell into a pond / he fell into the pond / uh but they weren't hurt and then they pulled themselves / out of the water / onto a log / and while the boy / and his dog were sitting on the log / they looked and they saw / a frog / and a frog family / and so then he realize that the frog that he had found the day before and put in the jar had a family at the pond / so he and his dog left the frog and his family at the pond / and waved goodbye	
